{
  "destinationId": "monfrague",
  "siteId": "monfrague-castillo",
  "dataStatus": "real",
  "algorithmVersion": "site-score-1.1.0",
  "generatedAt": "2026-09-17T14:24:50.512338Z",
  "caveats": [
    "Temperature comfort uses the monthly astronomical-night mean, not hourly utility"
  ],
  "months": [
    {
      "month": 1,
      "score": 78,
      "confidenceLevel": "high"
    },
    {
      "month": 2,
      "score": 83,
      "confidenceLevel": "high"
    },
    {
      "month": 3,
      "score": 83,
      "confidenceLevel": "high"
    },
    {
      "month": 4,
      "score": 82,
      "confidenceLevel": "high"
    },
    {
      "month": 5,
      "score": 84,
      "confidenceLevel": "high"
    },
    {
      "month": 6,
      "score": 90,
      "confidenceLevel": "high"
    },
    {
      "month": 7,
      "score": 92,
      "confidenceLevel": "high"
    },
    {
      "month": 8,
      "score": 92,
      "confidenceLevel": "high"
    },
    {
      "month": 9,
      "score": 89,
      "confidenceLevel": "high"
    },
    {
      "month": 10,
      "score": 82,
      "confidenceLevel": "high"
    },
    {
      "month": 11,
      "score": 80,
      "confidenceLevel": "high"
    },
    {
      "month": 12,
      "score": 77,
      "confidenceLevel": "high"
    }
  ]
}
