{
  "destinationId": "cosmic-campground",
  "siteId": "cosmic-observation-pads",
  "dataStatus": "real",
  "algorithmVersion": "site-score-1.1.0",
  "generatedAt": "2026-09-08T13:48:38.615208Z",
  "caveats": [
    "Temperature comfort uses the monthly astronomical-night mean, not hourly utility",
    "High-elevation temperature and wind come from the coarse ERA5 grid and are not a summit forecast; confidence is capped at moderate"
  ],
  "months": [
    {
      "month": 1,
      "score": 87,
      "confidenceLevel": "moderate"
    },
    {
      "month": 2,
      "score": 87,
      "confidenceLevel": "moderate"
    },
    {
      "month": 3,
      "score": 91,
      "confidenceLevel": "moderate"
    },
    {
      "month": 4,
      "score": 95,
      "confidenceLevel": "moderate"
    },
    {
      "month": 5,
      "score": 96,
      "confidenceLevel": "moderate"
    },
    {
      "month": 6,
      "score": 96,
      "confidenceLevel": "moderate"
    },
    {
      "month": 7,
      "score": 82,
      "confidenceLevel": "moderate"
    },
    {
      "month": 8,
      "score": 86,
      "confidenceLevel": "moderate"
    },
    {
      "month": 9,
      "score": 94,
      "confidenceLevel": "moderate"
    },
    {
      "month": 10,
      "score": 94,
      "confidenceLevel": "moderate"
    },
    {
      "month": 11,
      "score": 92,
      "confidenceLevel": "moderate"
    },
    {
      "month": 12,
      "score": 87,
      "confidenceLevel": "moderate"
    }
  ]
}
