{
  "destinationId": "death-valley",
  "siteId": "death-valley-dark-sky",
  "dataStatus": "real",
  "algorithmVersion": "site-score-1.0.0",
  "generatedAt": "2026-08-23T13:54:13.035903Z",
  "caveats": [
    "Temperature comfort uses the monthly astronomical-night mean, not hourly utility",
    "Curated elevation fallback used; DEM confidence is zero"
  ],
  "months": [
    {
      "month": 1,
      "score": 93,
      "confidenceLevel": "high"
    },
    {
      "month": 2,
      "score": 93,
      "confidenceLevel": "high"
    },
    {
      "month": 3,
      "score": 95,
      "confidenceLevel": "high"
    },
    {
      "month": 4,
      "score": 96,
      "confidenceLevel": "high"
    },
    {
      "month": 5,
      "score": 95,
      "confidenceLevel": "high"
    },
    {
      "month": 6,
      "score": 94,
      "confidenceLevel": "high"
    },
    {
      "month": 7,
      "score": 91,
      "confidenceLevel": "high"
    },
    {
      "month": 8,
      "score": 92,
      "confidenceLevel": "high"
    },
    {
      "month": 9,
      "score": 95,
      "confidenceLevel": "high"
    },
    {
      "month": 10,
      "score": 97,
      "confidenceLevel": "high"
    },
    {
      "month": 11,
      "score": 96,
      "confidenceLevel": "high"
    },
    {
      "month": 12,
      "score": 93,
      "confidenceLevel": "high"
    }
  ]
}
